{"entrypoint":"review_workspace.html","files":[{"path":"RUN-20261008-17/evaluation_package.json","role":"package","run_id":"RUN-20261008-17","sha256":"3454b9f74701d3f347081d18a638c75c923c6e46770c1dc0bee571ec22fb4e75"},{"path":"RUN-20261008-17/evaluation_report.md","role":"report","run_id":"RUN-20261008-17","sha256":"cdf645001e4dbb61746813bef491886dc89110a3e8350b91cbd88ec3bbefc1b2"},{"path":"RUN-20261008-17/evidence_bundle.json","role":"bundle","run_id":"RUN-20261008-17","sha256":"e90331aecedeb125d99978b6236c8ca3904d885cab262dbdb6e880ab47d5e95a"},{"path":"RUN-20261008-17/evidence_explorer.html","role":"viewer","run_id":"RUN-20261008-17","sha256":"bf62a3fe044e488a9659c0d74b03df04f40c519c608bfc5b7da81d792ec633f1"},{"path":"review_catalog.json","role":"catalog","run_id":null,"sha256":"b10ffe948d20f8fd29e1c7a32ae92442b3d0a38bd53798a3209d12145fe27b6d"},{"path":"review_workspace.html","role":"workspace","run_id":null,"sha256":"503c3b63855577eb5a09a6c71acab8863cf58b64b472b0b0520183c0912e8976"}],"ordering_policy":"path-v1","package_id":"REVIEW-PACKAGE-RUN-20261008-17","run_ids":["RUN-20261008-17"],"schema_version":"1.0"}
